<?xml version="1.0" encoding="UTF-8"?>
<xsd:schema xmlns:xsd="http://www.w3.org/2001/XMLSchema">

  <xsd:simpleType name="languageType">
    <xsd:restriction base="xsd:string"/>
  </xsd:simpleType>

  <xsd:element name="notes">
    <xsd:complexType>
      <xsd:sequence>
        <xsd:element name="note" maxOccurs="unbounded">
          <xsd:complexType>
            <xsd:sequence>
              <xsd:element name="title">
                <xsd:complexType>
                  <xsd:simpleContent>
                    <xsd:extension base="xsd:string">
                      <xsd:attribute name="jazyk" type="languageType" use="required"/>
                    </xsd:extension>
                  </xsd:simpleContent>
                </xsd:complexType>
              </xsd:element>
              <xsd:element name="author" type="xsd:string"/>
              <xsd:element name="content">
                <xsd:complexType>
                  <xsd:simpleContent>
                    <xsd:extension base="xsd:string">
                      <xsd:attribute name="category" type="xsd:string"/>
                    </xsd:extension>
                  </xsd:simpleContent>
                </xsd:complexType>
              </xsd:element>
              <xsd:element name="created_at" type="xsd:dateTime"/>
              <xsd:element name="updated_at" type="xsd:dateTime"/>
            </xsd:sequence>
          </xsd:complexType>
        </xsd:element>
      </xsd:sequence>
    </xsd:complexType>
  </xsd:element>

</xsd:schema>
